### ISSUE TITLE
Can't get flows from mikrotik 

### ISSUE THREAD

**Issue by rlex** [synfinatic/netflow2ng#17]
Hello! Getting some issue here.
Compiled as described in readme.
Launching:
```
root@adguard:~/netflow2ng/dist# ./netflow2ng-v0.0.2-8-g887b99b-linux-x86_64 -loglevel=debug -addr 192.168.69.22 -port 2056
INFO[0000] Starting netflow2ng
INFO[0001] Started ZMQ listener on: tcp://*:5556
INFO[0001] Listening on UDP 192.168.69.22:2056           Type=NetFlow
```

Verifying ports:
```
tcp        0      0 0.0.0.0:5556            0.0.0.0:*               LISTEN      18320/./netflow2ng-
tcp6       0      0 :::8080                 :::*                    LISTEN      18320/./netflow2ng-
udp        0      0 192.168.69.22:2056      0.0.0.0:*                           18320/./netflow2ng-
```

ntopng 5, added in config:
```
-i=tcp://127.0.0.1:5556
```
Can see interface in webui now but everything is empty and ntopng reports "no data on interface" alert.

ZMQ is reachable: 
```
lex@adguard:~$ telnet 127.0.0.1 5556
Trying 127.0.0.1...
Connected to 127.0.0.1.
Escape character is '^]'.
```

Can also see netflow packets with tcpdump.
Router is configured to send netflow v9 to 192.168.69.22:2056

**Comment by rlex** [comment]
Oh and a bit unrelated, but
> In theory, adding sFlow/IPFIX/NetFlow v5 support should be pretty trivial, but isn't something I plan on doing due to lack of hardware for testing/need.

RouterOS have x86 version with free edition (ports are limited to 10mbps tho) which supports netflow 3/5/9 and IPFIX as well.

**Comment by synfinatic** [comment]
three things:

1. Make sure you don't have a firewall dropping inbound udp/2056 packets.  Tcpdump will still show them, but netflow2ng can't see them if the firewall drops them
2. Verify that ntopng is connecting to netflow2ng on  tcp/5556 (tcpdump or logs?)
3. adding `-loglevel debug` should help?

**Comment by rlex** [comment]
1. No firewall on that VM, so definitely not dropping it
2. Looks like it attempts to connect and netflow2ng answers, this one is after ntopng restart:
```
lex@adguard:~$ sudo tcpdump -n -i lo port 5556
tcpdump: verbose output suppressed, use -v or -vv for full protocol decode
listening on lo, link-type EN10MB (Ethernet), capture size 262144 bytes
00:54:28.900413 IP 127.0.0.1.50618 > 127.0.0.1.5556: Flags [.], ack 1624895910, win 256, options [nop,nop,TS val 2654045956 ecr 2654015363], length 0
00:54:28.900472 IP 127.0.0.1.5556 > 127.0.0.1.50618: Flags [.], ack 1, win 256, options [nop,nop,TS val 2654045956 ecr 2654015363], length 0
00:54:31.721407 IP 127.0.0.1.50618 > 127.0.0.1.5556: Flags [F.], seq 1, ack 1, win 256, options [nop,nop,TS val 2654048777 ecr 2654045956], length 0
00:54:31.721588 IP 127.0.0.1.5556 > 127.0.0.1.50618: Flags [F.], seq 1, ack 2, win 256, options [nop,nop,TS val 2654048777 ecr 2654048777], length 0
00:54:31.721600 IP 127.0.0.1.50618 > 127.0.0.1.5556: Flags [.], ack 2, win 256, options [nop,nop,TS val 2654048777 ecr 2654048777], length 0
00:54:32.409115 IP 127.0.0.1.50638 > 127.0.0.1.5556: Flags [S], seq 3994772085, win 65535, options [mss 65495,sackOK,TS val 2654049465 ecr 0,nop,wscale 8], length 0
00:54:32.409125 IP 127.0.0.1.5556 > 127.0.0.1.50638: Flags [S.], seq 467599063, ack 3994772086, win 65483, options [mss 65495,sackOK,TS val 2654049465 ecr 2654049465,nop,wscale 8], length 0
00:54:32.409133 IP 127.0.0.1.50638 > 127.0.0.1.5556: Flags [.], ack 1, win 256, options [nop,nop,TS val 2654049465 ecr 2654049465], length 0
00:54:32.409279 IP 127.0.0.1.5556 > 127.0.0.1.50638: Flags [P.], seq 1:11, ack 1, win 256, options [nop,nop,TS val 2654049465 ecr 2654049465], length 10
00:54:32.409573 IP 127.0.0.1.50638 > 127.0.0.1.5556: Flags [.], ack 11, win 256, options [nop,nop,TS val 2654049465 ecr 2654049465], length 0
00:54:32.409927 IP 127.0.0.1.50638 > 127.0.0.1.5556: Flags [P.], seq 1:12, ack 11, win 256, options [nop,nop,TS val 2654049466 ecr 2654049465], length 11
00:54:32.409931 IP 127.0.0.1.5556 > 127.0.0.1.50638: Flags [.], ack 12, win 256, options [nop,nop,TS val 2654049466 ecr 2654049466], length 0
00:54:32.409977 IP 127.0.0.1.5556 > 127.0.0.1.50638: Flags [P.], seq 11:65, ack 12, win 256, options [nop,nop,TS val 2654049466 ecr 2654049466], length 54
00:54:32.410123 IP 127.0.0.1.50638 > 127.0.0.1.5556: Flags [.], ack 65, win 256, options [nop,nop,TS val 2654049466 ecr 2654049466], length 0
00:54:32.416355 IP 127.0.0.1.50638 > 127.0.0.1.5556: Flags [P.], seq 12:65, ack 65, win 256, options [nop,nop,TS val 2654049472 ecr 2654049466], length 53
00:54:32.416360 IP 127.0.0.1.5556 > 127.0.0.1.50638: Flags [.], ack 65, win 256, options [nop,nop,TS val 2654049472 ecr 2654049472], length 0
00:54:32.416417 IP 127.0.0.1.5556 > 127.0.0.1.50638: Flags [P.], seq 65:92, ack 65, win 256, options [nop,nop,TS val 2654049472 ecr 2654049472], length 27
00:54:32.416549 IP 127.0.0.1.50638 > 127.0.0.1.5556: Flags [.], ack 92, win 256, options [nop,nop,TS val 2654049472 ecr 2654049472], length 0
00:54:32.416623 IP 127.0.0.1.50638 > 127.0.0.1.5556: Flags [P.], seq 65:92, ack 92, win 256, options [nop,nop,TS val 2654049472 ecr 2654049472], length 27
00:54:32.416627 IP 127.0.0.1.5556 > 127.0.0.1.50638: Flags [.], ack 92, win 256, options [nop,nop,TS val 2654049472 ecr 2654049472], length 0
00:54:32.416760 IP 127.0.0.1.50638 > 127.0.0.1.5556: Flags [P.], seq 92:145, ack 92, win 256, options [nop,nop,TS val 2654049473 ecr 2654049472], length 53
00:54:32.416764 IP 127.0.0.1.5556 > 127.0.0.1.50638: Flags [.], ack 145, win 256, options [nop,nop,TS val 2654049473 ecr 2654049473], length 0
```

3. -loglevel=debug is already there, no messages produced. Last line in log is 
```
INFO[0001] Listening on UDP :2056                        Type=NetFlow
```

**Comment by rlex** [comment]
Okay, it seems i found the culprit. 
Mikrotik netflow implementation allows you to set SRC IP. I used to have 0.0.0.0 here and it worked with ES-based ntop and nprobe back in the day. It's also default setting. What happens is
```
01:00:59.986367 IP 0.0.0.0.2056 > 192.168.69.22.2056: UDP, length 1400
01:01:01.016358 IP 0.0.0.0.2056 > 192.168.69.22.2056: UDP, length 1400
01:01:02.056329 IP 0.0.0.0.2056 > 192.168.69.22.2056: UDP, length 1400
01:01:03.096336 IP 0.0.0.0.2056 > 192.168.69.22.2056: UDP, length 1056
01:01:03.096336 IP 0.0.0.0.2056 > 192.168.69.22.2056: UDP, length 144
01:01:05.176302 IP 0.0.0.0.2056 > 192.168.69.22.2056: UDP, length 1400
01:01:06.216352 IP 0.0.0.0.2056 > 192.168.69.22.2056: UDP, length 1400
01:01:07.256445 IP 0.0.0.0.2056 > 192.168.69.22.2056: UDP, length 456
01:01:09.346396 IP 0.0.0.0.2056 > 192.168.69.22.2056: UDP, length 1144
```

Setting it to real ip of router started to produce packets in ntopng.
