### ISSUE TITLE
Data flow from mikrotik

### ISSUE THREAD

**Issue by Jcbarraza** [synfinatic/netflow2ng#82]
I have not been able to get ntop to receive data from the different mikrotik. I've already made all the correct settings or so I think

![Image](https://github.com/user-attachments/assets/2db5bd2c-0d25-4d73-8b7c-b0544418f053)

![Image](https://github.com/user-attachments/assets/109133b6-475b-4957-8b99-b199f5182077)

![Image](https://github.com/user-attachments/assets/d06683ce-fa4b-40d9-9fdb-3643e6e8bda6)

![Image](https://github.com/user-attachments/assets/87783c5e-349d-4ecb-80f5-f14221c23d81)

**Comment by synfinatic** [comment]
mikrotik comes up a fair bit if you search the issues.  example: https://github.com/synfinatic/netflow2ng/issues/52

**Comment by Arthur-G** [comment]
For me, with RouterOS 7, it works. Have you checked with tcpdump if you are receiving Netflix traffic on the collection server ?

**Comment by Jcbarraza** [comment]
> Para mí, con RouterOS 7, funciona. ¿Ha comprobado con tcpdump si está recibiendo tráfico de Netflow en el servidor de recopilación?

Thanks for replying. I'm new to this. Could you help me?

**Comment by litinoveweedle** [comment]
I have no issue with flows export from Mikrotik ROS 7 (up to 7.18.2), but only using ntopng 5.6. There seems to be something wrong with ntopng 6.2 ( and probably 6.0 as reported by others), as no flows are detected. This seems to be related to the issue #52 which was already linked by @synfinatic .

**Comment by Jcbarraza** [comment]
> No tengo ningún problema con la exportación de flujos desde Mikrotik ROS 7 (hasta 7.18.2), pero solo usando ntopng 5.6. Parece que hay algo mal con ntopng 6.2 (y probablemente 6.0 según lo informado por otros), ya que no se detectan flujos. Esto parece estar relacionado con el problema [#52](https://github.com/synfinatic/netflow2ng/issues/52) que ya estaba vinculado por .

Do you have the .deb available for you to rule it for me? I can't install that version

**Comment by litinoveweedle** [comment]
No sorry, I do compilation from source as part of my Hassio add-on Docker installation.

**Comment by polycarp-laurent** [comment]
I am having exactly same issue with ntopng v6.3, I am exporting from Mikrotik ROS 7.18, the ZMQ messages are populated on ntopng but there is no flow collected. 

I highly suspect this has something todo with the version of ntopng, v6, I am going to try to install version 5.7 and see if it will solve the issue, I will keep you all know how it goes.

<img width="638" alt="Image" src="https://github.com/user-attachments/assets/eaac151c-55ff-48c4-bde6-3b5c4237f615" />

polycarp@GetoPi5-SRV01:~ $ sudo netflow2ng-0.0.5 -a 0.0.0.0:2055 -m 10.1.1.2:8181 -z tcp://127.0.0.1:5556 --log-level debug --
DEBUG   Using default log style                      
INFO    Starting netflow2ng                          
INFO    Started ZMQ listener on: tcp://127.0.0.1:5556 
INFO    Listening on UDP 0.0.0.0:2055                 Type=NetFlow
DEBUG   sent 319 bytes of json: {"1":1263,"10":19,"11":3000,"12":"10.1.1.2","130":"10.1.1.1","14":8,"15":"0.0.0.0","16":0,"17":0,"2":7,"21":1745397991,"22":1745397991,"29":0,"30":0,"32":0,"4":6,"44":0,"45":0,"5":0,"52":0,"54":0,"58":0,"59":0,"6":2,"60":4,"61":0,"7":64743,"8":"10.1.2.3","80":"00:00:00:00:00:00","81":"00:00:00:00:00:00","88":0,"89":0} 
DEBUG   sent 320 bytes of json: {"1":1575,"10":8,"11":64743,"12":"10.1.2.3","130":"10.1.1.1","14":19,"15":"0.0.0.0","16":0,"17":0,"2":6,"21":1745397991,"22":1745397991,"29":0,"30":0,"32":0,"4":6,"44":0,"45":0,"5":0,"52":0,"54":0,"58":0,"59":0,"6":18,"60":4,"61":0,"7":3000,"8":"10.1.1.2","80":"ce:b8:a3:b8:f6:99","81":"83:80:e5:a1:d7:9f","88":0,"89":0} 
^C
polycarp@GetoPi5-SRV01:~ $ 


polycarp@GetoPi5-SRV01:~ $ sudo tcpdump -n -i any udp port 2055
tcpdump: data link type LINUX_SLL2
tcpdump: verbose output suppressed, use -v[v]... for full protocol decode
listening on any, link-type LINUX_SLL2 (Linux cooked v2), snapshot length 262144 bytes
10:47:38.350765 eth0  In  IP 10.1.1.1.2055 > 10.1.1.2.2055: UDP, length 212
10:47:40.430715 eth0  In  IP 10.1.1.1.2055 > 10.1.1.2.2055: UDP, length 400
10:47:44.590745 eth0  In  IP 10.1.1.1.2055 > 10.1.1.2.2055: UDP, length 684
3 packets captured
4 packets received by filter
0 packets dropped by kernel
polycarp@GetoPi5-SRV01:~ $ 


  GNU nano 7.2                                  /etc/systemd/system/ntopng.service                                            
[Unit]
Description=ntopng 
After=network.target redis.service
Requires=redis.service

[Service]
Type=simple
ExecStart=/usr/local/bin/ntopng -i eth0 -i zmq://127.0.0.1:5556 -w 3000 -d /var/lib/ntopng -G /var/run/ntopng/ntopng.pid


PIDFile=/var/run/ntopng/ntopng.pid
Restart=on-failure

[Install]
WantedBy=multi-user.target

**Comment by polycarp-laurent** [comment]
> I have no issue with flows export from Mikrotik ROS 7 (up to 7.18.2), but only using ntopng 5.6. There seems to be something wrong with ntopng 6.2 ( and probably 6.0 as reported by others), as no flows are detected. This seems to be related to the issue [#52](https://github.com/synfinatic/netflow2ng/issues/52) which was already linked by [@synfinatic](https://github.com/synfinatic) .

How did you install the v5.7? or you have had it before the release of later versions and you didnot upgrade?

**Comment by kellybyrd** [comment]
> Hello [@benibunny](https://github.com/benibunny) , great job👍, thank you. I can confirm, that ntopng 6.4 now works fine with your patch. So the problem seems to be, that zmq format will be dropped from the ntopng completely... 😳

#89 has been fixed in main.
